{"format":"worldmusichub-complete-score","version":1,"source":{"format":"midi","bytes":130,"sha256":"7e5fea609420469fc4178cb8f1d740c80a3f07d0833632794aa0cd68375e5315"},"notation":{"format_metadata":{"schema_revision":2,"producer":"WorldMusicHub","producer_version":"0.2.0-alpha.1"},"version":1,"id":"midi-basic-7e5fea609420469fc4178cb8f1d740c80a3f07d0833632794aa0cd68375e5315","title":"Original basic-key acceptance","composer":"","provenance":{"kind":"user_supplied_unverified","attribution":"User-supplied MIDI; source rights unverified; nominal MIDI key-number projection","source_url":null,"license":null},"parts":[{"id":"midi-t1-c1-r0","name":"Track 1 / ch 1","instrument":"midi-key-number","notes":[{"id":"midi-t1-e4","at":{"numerator":0,"denominator":1},"duration":{"numerator":24,"denominator":1},"pitch":{"step":"C","alter":0,"octave":4},"voice":"1","staff":1,"velocity":90,"tie_start":false,"tie_stop":false}]},{"id":"midi-t2-c10-r0","name":"Track 2 / ch 10","instrument":"midi-percussion-key-number","notes":[{"id":"midi-t2-e1","at":{"numerator":0,"denominator":1},"duration":{"numerator":1,"denominator":2},"pitch":{"step":"B","alter":0,"octave":1},"voice":"1","staff":1,"velocity":100,"tie_start":false,"tie_stop":false}]},{"id":"midi-t3-c1-r0","name":"Track 3 / ch 1","instrument":"midi-key-number","notes":[{"id":"midi-t3-e1","at":{"numerator":1,"denominator":1},"duration":{"numerator":1,"denominator":1},"pitch":{"step":"C","alter":0,"octave":5},"voice":"1","staff":1,"velocity":80,"tie_start":false,"tie_stop":false}]}],"tempo":[],"meters":[],"keys":[],"measures":[],"repeats":[],"source":null},"performance":{"profile":"wmh-basic-keys-midi1-v1","source_format":1,"ppq":96,"end_tick":2304,"tracks":[{"id":"track-1","name":"Track 1","source_index":0,"end_tick":2304,"events":[[0,[176,0,7]],[0,[192,42]],[0,[176,74,91]],[0,[144,60,90]],[2304,[128,60,0]],[0,[144,64,90]],[0,[128,64,0]],[0,[144,67,90]],[0,[255,47]]]},{"id":"track-2","name":"Track 2","source_index":1,"end_tick":48,"events":[[0,[153,35,100]],[48,[137,35,0]],[0,[255,47]]]},{"id":"track-3","name":"Track 3","source_index":2,"end_tick":192,"events":[[96,[144,72,80]],[96,[128,72,0]],[0,[255,47]]]},{"id":"track-4","name":"Track 4","source_index":3,"end_tick":0,"events":[[0,[255,1,110,111,116,101]],[0,[255,47]]]},{"id":"track-5","name":"Track 5","source_index":4,"end_tick":0,"events":[[0,[255,47]]]}],"routes":[{"port":null,"device_name_bytes":null}],"parts":[{"id":"midi-t1-c1-r0","track_id":"track-1","channel":0,"route":0,"key_semantics":"midi_key_number"},{"id":"midi-t2-c10-r0","track_id":"track-2","channel":9,"route":0,"key_semantics":"channel10_key_number_percussion_unresolved"},{"id":"midi-t3-c1-r0","track_id":"track-3","channel":0,"route":0,"key_semantics":"midi_key_number"}],"timing":{"event_order":"tick_track_index_event_index","relative_clock_available":true,"end_relative_microseconds":{"numerator":"12000000","denominator":1},"smf_default_tempo_used":true,"source_tempo_events":0,"source_meter_events":0,"meter":"unspecified","legacy_running_status_events":0,"invalid_program_events":0}},"coverage":{"source_tracks":5,"source_events":18,"represented_events":18,"key_attacks":5,"key_releases":4,"determined_ends":4,"zero_length_attacks":1,"unresolved_ends":1,"unmatched_releases":0,"notation_notes":3,"projected_melodic_targets":2,"unresolved_route_ends":0},"capabilities":{"source_events":"complete","basic_keys":"unresolved_ends","score_projection":"partial_positive_duration_keys","source_rendition":"requires_explicit_receiver_mapping","acoustic_pitch":"not_inferred_from_key_numbers"}}