{"format":"worldmusichub-complete-score","version":1,"source":{"format":"midi","bytes":110,"sha256":"bc453c1938ba1f62d8529d3469f3d0cddda2814e84857a7e075cf280c3b37442"},"notation":{"format_metadata":{"schema_revision":2,"producer":"WorldMusicHub","producer_version":"0.2.0-alpha.1"},"version":1,"id":"midi-basic-bc453c1938ba1f62d8529d3469f3d0cddda2814e84857a7e075cf280c3b37442","title":"Original schema exercise","composer":"","provenance":{"kind":"user_supplied_unverified","attribution":"User-supplied MIDI; source rights unverified; nominal MIDI key-number projection","source_url":null,"license":null},"parts":[{"id":"midi-t2-c1-r0","name":"Track 2 / ch 1","instrument":"midi-key-number","notes":[{"id":"midi-t2-e1","at":{"numerator":0,"denominator":1},"duration":{"numerator":1,"denominator":1},"pitch":{"step":"C","alter":0,"octave":4},"voice":"1","staff":1,"velocity":90,"tie_start":false,"tie_stop":false}]},{"id":"midi-t3-c2-r0","name":"Track 3 / ch 2","instrument":"midi-key-number","notes":[{"id":"midi-t3-e4","at":{"numerator":0,"denominator":1},"duration":{"numerator":2,"denominator":1},"pitch":{"step":"G","alter":0,"octave":3},"voice":"1","staff":1,"velocity":80,"tie_start":false,"tie_stop":false}]}],"tempo":[{"at":{"numerator":0,"denominator":1},"bpm":120.0}],"meters":[{"at":{"numerator":0,"denominator":1},"numerator":4,"denominator":4}],"keys":[],"measures":[],"repeats":[],"source":null},"performance":{"profile":"wmh-basic-keys-midi1-v1","source_format":1,"ppq":480,"end_tick":960,"tracks":[{"id":"track-1","name":"Track 1","source_index":0,"end_tick":960,"events":[[0,[255,81,7,161,32]],[0,[255,88,4,2,24,8]],[960,[255,47]]]},{"id":"track-2","name":"Track 2","source_index":1,"end_tick":960,"events":[[0,[144,60,90]],[480,[128,60,64]],[0,[144,64,75]],[0,[128,64,0]],[0,[144,67,95]],[480,[255,47]]]},{"id":"track-3","name":"Track 3","source_index":2,"end_tick":960,"events":[[0,[193,24]],[0,[177,7,80]],[0,[240,125,0,247]],[0,[145,55,80]],[960,[129,55,0]],[0,[255,47]]]}],"routes":[{"port":null,"device_name_bytes":null}],"parts":[{"id":"midi-t2-c1-r0","track_id":"track-2","channel":0,"route":0,"key_semantics":"midi_key_number"},{"id":"midi-t3-c2-r0","track_id":"track-3","channel":1,"route":0,"key_semantics":"midi_key_number"}],"timing":{"event_order":"tick_track_index_event_index","relative_clock_available":true,"end_relative_microseconds":{"numerator":"1000000","denominator":1},"smf_default_tempo_used":false,"source_tempo_events":1,"source_meter_events":1,"meter":"source_declared","legacy_running_status_events":0,"invalid_program_events":0}},"coverage":{"source_tracks":3,"source_events":15,"represented_events":15,"key_attacks":4,"key_releases":3,"determined_ends":3,"zero_length_attacks":1,"unresolved_ends":1,"unmatched_releases":0,"notation_notes":2,"projected_melodic_targets":2,"unresolved_route_ends":0},"capabilities":{"source_events":"complete","basic_keys":"unresolved_ends","score_projection":"partial_positive_duration_keys","source_rendition":"requires_explicit_receiver_mapping","acoustic_pitch":"not_inferred_from_key_numbers"}}